OrderID,GenProductName
CA-2016-152156,Bush Somerset Collection Bookcase
CA-2016-152156,Hon Deluxe Fabric Chairs
CA-2016-138688,Self Address Labels Typewriters Universal
US-2015-108966,Bretford CR4500 Series Slim Table
US-2015-108966,Eldon Fold N Roll Cart System
CA-2014-115812,Eldon Expressions Wood Plastic Desk Accessories Cherry Wood
CA-2014-115812,Newell
CA-2014-115812,Mitel IP Phone VoIP phone
CA-2014-115812,DXL Angle View Binders Rings Samsill
CA-2014-115812,Belkin F5C206VTEL Outlet Surge
CA-2014-115812,Chromcraft Conference Tables
CA-2014-115812,Konftel ConferenceÂ phoneÂ Charcoal
CA-2017-114412,Xerox
CA-2016-161389,Fellowes PB200 Plastic Comb Machine
US-2015-118983,Holmes Replacement Filter HEPA Air Cleaner Room HEPA Filter
US-2015-118983,Storex DuraTech Plastic Binders
CA-2014-105893,Stur D Stor Shelf H x W x D
CA-2014-167164,Fellowes Super Stor Drawer
CA-2014-143336,Newell
CA-2014-143336,Cisco SPA IP Phone
CA-2014-143336,Wilson Jones View Binder White
CA-2016-137330,Newell
CA-2016-137330,Acco Six Outlet Power Strip Cord Length
US-2017-156909,Deluxe Chair Gray
CA-2015-106320,Bretford CR4500 Series Slim Table
CA-2016-121755,Wilson Jones Use Binders
CA-2016-121755,ImationÂ Mini TravelDrive USB Flash Drive
US-2015-150630,Riverside Palais Royal Lawyers Bookcase Royale Cherry Finish
US-2015-150630,Avery Flexi View Covers Systems
US-2015-150630,Howard Miller Diameter Chrome Round Wall Clock
US-2015-150630,Poly Tie Envelopes
US-2015-150630,BOSTON Model Electric Pencil Sharpeners Putty Woodgrain
US-2015-150630,Acco Pressboard Covers Storage Hooks x Executive
US-2015-150630,Lumber Crayons
CA-2017-107727,staple paper
CA-2016-117590,GE
CA-2016-117590,Electrix Architect Clamp Arm Lamp Black
CA-2015-117415,x Premium Seam Envelopes
CA-2015-117415,Atlantic Metals Mobile Shelf Bookcases Custom Colors
CA-2015-117415,Fabric Manager Chair Dark Gray
CA-2015-117415,Plantronics HL10 Handset Lifter
CA-2017-120999,Panasonic Kx TS550
CA-2016-101343,Eldon Base storage shelf platinum
CA-2017-139619,Advantus Drawer Organizer Chrome Metal Frame Smoke Drawers
CA-2016-118255,Verbatim GB Blu ray Single Layer Disc Pack
CA-2016-118255,Wilson Jones Leather Binders DublLock Round Rings
CA-2014-146703,Gould Plastics Pocket Panel Bin x x Black
CA-2016-169194,ImationÂ Micro Traveldrive Usb Flash Drive
CA-2016-169194,LF Elite Dazzle Designer Hard Case Cover Lf Stylus Pen Apple Iphone Mini Lite
CA-2015-115742,Line Peel Stick Pockets x Pack
CA-2015-115742,Avery
CA-2015-115742,Life White Bulbs
CA-2015-115742,Leather Task Chair Black
CA-2016-105816,Advantus Push Pins
CA-2016-105816,AT T CL83451 Handset Telephone
CA-2016-111682,Home Office File Carts
CA-2016-111682,Xerox
CA-2016-111682,Novimex Turbo Task Chair
CA-2016-111682,Array Parchment Paper Colors
CA-2016-111682,ImationÂ Micro Traveldrive Usb Flash Drive
CA-2016-111682,Plastic Combs
CA-2016-111682,Prang Dustless Chalk Sticks
CA-2015-135545,Verbatim GB Blu ray Single Layer Disc Pack
CA-2015-135545,Acco PRESSTEX Data Binder Storage Hooks Dark Blue X
CA-2015-135545,Xerox
CA-2015-135545,Luxo Economy Arm Lamp
US-2015-164175,Value Mid Manager Chair Gray
CA-2014-106376,Hunt BOSTON Model Volume Electric Pencil Sharpener Beige
CA-2014-106376,netTALK DUO VoIP Telephone Service
CA-2016-119823,Snap Way Black Print Carbonless Speed Letter Triplicate
CA-2016-106075,Avery System Hidden Tab Executive Style Index Sets
CA-2017-114440,Telephone Message Books Fax Mobile Section x
US-2015-134026,Leather Manager Chair
US-2015-134026,Tenex Chairmats Medium Pile Carpet Standard Lip x
US-2015-134026,Safco Industrial Wire System
US-2017-118038,Economy Binders
US-2017-118038,Cubicle Wall Clock Black
US-2017-118038,SimpliFile File Black Granite x x
US-2014-147606,Eldon Expressions Desk Accessory Wood Pencil Holder Oak
CA-2016-127208,Foot Cube Office Refrigerators
CA-2016-127208,Avery Heavy Duty EZD Binder Rings
CA-2014-139451,Premium Pencils Association
CA-2014-139451,Sortfiler Multipurpose File Organizer Black
CA-2015-149734,Jet Pak Peel N Seal Mailers
US-2017-119662,Safco Industrial Wire
CA-2017-140088,Novimex Swivel Fabric Task Chair
CA-2017-155558,LogitechÂ LS21 Speaker System PC Multimedia CH
CA-2017-155558,Avery
CA-2016-159695,Eldon Mobile Manager
CA-2016-109806,Turquoise Lead Holder Pocket Clip
CA-2016-109806,Panasonic Kx TS550
CA-2016-109806,Xerox
CA-2015-149587,Xerox
CA-2015-149587,Seth Thomas Wall Clock
CA-2015-149587,Ibico Standard Transparent Covers
US-2017-109484,Leather Collection Binder
CA-2017-161018,Diameter Round Wall Clock
CA-2017-157833,Trimflex Post Binders
CA-2016-149223,Fellowes Home Office Series Surge Protectors
CA-2016-158568,Avery Creations Heavyweight Cards
CA-2016-158568,SanDisk Ultra GB MicroSDHC Class Memory Card
CA-2016-158568,Avery Hidden Tab Dividers Systems
CA-2016-129903,Universal Premium White Copier Laser Paper Bright
US-2015-156867,Logitech K350 Wireless Keyboard
US-2015-156867,Deflect DuraMat Lighweight Mat Pile
US-2015-156867,Avery Trapezoid Binder Capacity Black sheet
CA-2017-119004,Memorex Mini Travel Drive GB USB Flash Drive
CA-2017-119004,Speck Products Candyshell Flip Case
CA-2017-119004,Newell Chalk Holder
CA-2015-129476,LogitechÂ G510s Keyboard
CA-2017-146780,Arm Lamp
CA-2016-128867,Hunt PowerHouse Electric Pencil Sharpener Blue
CA-2016-128867,Avery Plastic Binders
CA-2014-115259,OIC Binder Clips Sizes
CA-2014-115259,Redi Strip Envelopes x
CA-2014-115259,Xerox
CA-2014-115259,Tyvek Peel Seel Envelopes Plain White
CA-2015-110457,Hon Racetrack Conference Tables
US-2015-136476,GBC DocuBind Electric Machine
CA-2016-103730,Insta Plaque
CA-2016-103730,DXL Angle View Binders Rings Samsill
CA-2016-103730,Companion Letter File Black
CA-2016-103730,Globe Weis Peel Seel Class Envelopes
CA-2016-103730,KLD Oscar II Style Snap Ultra Thin Side Flip Leather Cover Case HTC HTC M7
US-2014-152030,Deluxe Manager Chair
US-2014-134614,Bevis x Conference Tables
US-2017-107272,Avery Slant Binders Labels
US-2017-107272,Trav L File Heavy Duty Shuttle II Black
US-2016-125969,Task Chair Black
US-2016-125969,Eldon Cleatmat Chair Mats Pile Carpets
US-2017-164147,Anker Port USB Wall Charger Travel Power Adapter iPhone
US-2017-164147,Xerox
US-2017-164147,Staples
CA-2016-145583,Xerox
CA-2016-145583,Xerox
CA-2016-145583,Sanford Colorific Pencils Box
CA-2016-145583,Ideal Clamps
CA-2016-145583,GBC Wire Strips
CA-2016-145583,Fiskars Softgrip Scissors
CA-2016-145583,Life White Bulbs
CA-2016-110366,Howard Miller Diameter Chrome Round Wall Clock
CA-2017-106180,Newell
CA-2017-106180,Convenience Packs Business Envelopes
CA-2017-106180,Xerox
CA-2017-155376,Sanyo Foot Mid Size Office Refrigerators
CA-2015-110744,Safco Industrial Wire
CA-2014-110072,Seth Thomas Putty Wall Clock
CA-2016-114489,Plantronics CordlessÂ Phone HeadsetÂ line Volume M214C
CA-2016-114489,Anker Astro USB Charger
CA-2016-114489,Hon Deluxe Fabric Chairs
CA-2016-114489,GBC Prestige Therm Covers
CA-2016-158834,Belkin Outlet SurgeMaster Surge Protector Phone Protection
CA-2016-158834,Jabra BIZ Duo QD Duo CordedÂ Headset
CA-2015-124919,Southworth Cotton Antique Laid Paper Envelopes
CA-2015-124919,Xerox
CA-2015-124919,Tenex Project File Scoop Front Design Black
CA-2015-118948,Newell
CA-2014-104269,Deluxe Manager Chair
CA-2016-114104,Avery
CA-2016-114104,Avaya Digital phone
CA-2016-162733,Xerox
CA-2015-119697,Lenovo Key USB Keypad
CA-2016-154508,Staple envelope
CA-2016-113817,Wilson Jones International Size A4 Binders
CA-2014-139892,BIC Brite Liner Highlighters
CA-2014-139892,Lexmark MX611dhe Monochrome Laser Printer
CA-2014-139892,Space Solutions HD Industrial Steel
CA-2014-139892,SAFCO Arco Chair
CA-2014-139892,Sanford Liquid Accent Highlighters
CA-2014-139892,Kensington Outlet MasterPiece Power Center
CA-2014-139892,JBL Micro Wireless Speaker
CA-2014-118962,Adams Phone Message Book Message Capacity x
CA-2014-118962,Xerox
CA-2014-118962,Value Steno Chair Gray
US-2014-100853,Kensington Outlet MasterPiece HOMEOFFICE Power Control Center
US-2014-100853,Avery
US-2017-152366,Acco Outlet Masterpiece Power Center Fax Phone Line Protection
US-2015-101511,Chairs Black Carton
US-2015-101511,Acme Rosewood Letter Opener
CA-2015-137225,Sanford Colorific Pencils Count
CA-2014-166191,Tenex File Box Tote Lid Black
CA-2014-166191,ImationÂ Secure Hardware USB Flash Drive
CA-2014-158274,AT T TR1909W
CA-2014-158274,Nokia Lumia T Mobile
CA-2014-158274,HP Standard key PS Keyboard
CA-2016-105018,Avery Poly Binder Pockets
CA-2014-123260,SanDisk Ultra GB MicroSDHC Class Memory Card
CA-2016-157000,Tote Lid Black Gray
CA-2016-157000,Southworth Cotton Antique Laid Paper Envelopes
CA-2015-102281,Atlantic Metals Mobile Shelf Bookcases Custom Colors
CA-2015-102281,Need Hello Kitty Silicone Case Cover HTC X Hello Kitty Stylus Pen pink
CA-2015-102281,Xerox
CA-2015-102281,Atlantic Metals Mobile Shelf Bookcases Custom Colors
CA-2015-102281,Highlighters Sanford
CA-2015-131457,Poly Tie Envelopes
CA-2014-140004,Binney Smith Crayola Pencils Color Set
CA-2014-140004,Binney Smith inkTank Desk Highlighter Chisel Tip Box
CA-2017-107720,Decoflex Folder File
US-2017-124303,Pressboard Covers Storage Hooks x Light Blue
US-2017-124303,Message Books x Forms Forms Page
CA-2017-105074,Southworth Cotton Linen Finish Paper Envelopes
CA-2014-133690,BoxOffice Design Half Moon Room Tables
CA-2014-133690,Bravo II Megaboss Amp Hard Body Upright Replacement Belts Belts Pack
US-2017-116701,Eureka Sanitaire Upright
CA-2017-126382,Eldon Class Desk Accessories Burgundy
CA-2017-108329,Nortel Business Series Terminal T7208 Digital phone
CA-2017-135860,Tennsco Lockers Gray
CA-2017-135860,Panasonic KX TG6844B Digital Cordless Telephone
CA-2017-135860,Avery Slant Binders Labels
CA-2017-135860,Advantus Push Pins Aluminum Head
CA-2017-135860,Gould Plastics Pocket Panel Bin x x
CA-2015-101007,Memorex Micro Travel Drive GB
CA-2015-146262,Avery
CA-2015-146262,O Sullivan Door Barrister Bookcase Odessa Pine
CA-2015-146262,Speck Products Candyshell Flip Case
CA-2015-146262,Cisco IP Video Phone Charcoal
CA-2015-146262,Sony Micro Vault Click GB USB Flash Drive
CA-2016-130162,Tote Lid Black Gray
CA-2016-130162,Adtran
CA-2015-169397,OIC Bulk Pack Metal Binder Clips
CA-2015-169397,Pads Pad x Cycle
CA-2015-169397,Ibico Standard Transparent Covers
CA-2015-169397,Executive Impressions Color Numerals Wall Clock
CA-2015-169397,Swingline SM12 MicroCut Jam Shredder
CA-2015-169397,Stanley Bostitch Electric Pencil Sharpeners
CA-2015-163055,Sanford Uni Blazer View Highlighters Chisel Tip
CA-2015-163055,Bevis x Conference Tables
CA-2015-163055,Rogers Deluxe File
US-2015-145436,Tilter Chair
US-2015-145436,Push Button Manager Chair Indigo
US-2014-156216,GBC Instant Index System Systems
US-2017-100930,Bush Advantage Collection Round Conference Table
US-2017-100930,Bretford Conference Table Tops
US-2017-100930,GBC Instant Index System Systems
US-2017-100930,Tenex Contur Chairmats Medium Pile Carpet Computer x
US-2017-100930,LogitechÂ P710e Mobile Speakerphone
CA-2017-160514,Xerox Series MultiUse Premium Copy Paper Bright
CA-2016-157749,Xerox
CA-2016-157749,Luxo Fluorescent Lamp Clamp Mount Base
CA-2016-157749,Staple wall
CA-2016-157749,Roll Screen Protector
CA-2016-157749,KI Conference Tables
CA-2016-157749,Eldon Class Desk Accessories
CA-2016-157749,Binney Smith Crayola Pencils Color Set
CA-2014-131926,Deluxe Manager Chair
CA-2014-131926,Safco Steel Mobile File Cart
CA-2014-131926,Adams Telephone Message Book w Numbers Space Messages Book
CA-2014-131926,Honeywell Enviracaire HEPA Air Cleaner x Room
CA-2014-131926,Xerox
CA-2016-154739,Leather Highback Executive Chair Height Adjustment Black
CA-2016-145625,Message Books x Forms Page
CA-2016-145625,LogitechÂ P710e Mobile Speakerphone
CA-2016-146941,Fellowes Folder Files Navy
CA-2016-146941,Tyvek Side Peel Seel Envelopes
US-2015-159982,Eldon Class Desk Accessories
US-2015-159982,Belkin Equipment Shelf Black
US-2015-159982,Tenex Project File Scoop Front Design Black
US-2015-159982,Logitech Mobile Speakerphone P710e Â speaker phone
CA-2017-163139,Sabrent Port USB Hub
CA-2017-163139,Safco Industrial
CA-2017-163139,Acco Hole Punch
US-2017-155299,Eureka Bags Sanitaire Vibra Groomer Upright Vac
US-2014-106992,Lexmark MX611dhe Monochrome Laser Printer
US-2014-106992,Xerox WorkCentre Laser Multifunction Printer
CA-2016-125318,Cisco Small Business SPA VoIP phone
CA-2015-155040,Microsoft Sculpt Comfort Mouse
CA-2017-136826,Quartet Omega Chalk Pack
CA-2016-111010,Rubber Bands
US-2017-145366,Safco
US-2017-145366,Interoffice Envelopes Button Closure x
CA-2017-163979,Depth Letter Cart
CA-2015-155334,Logitech M325 Wireless Mouse Web
CA-2015-155334,Regeneration Desk Collection
CA-2015-155334,Presstex Binders
CA-2017-118136,Ampad Gold Fibre Steno Books x Gregg
CA-2017-118136,Newell
CA-2017-132976,Post â Important Messageâ Note Pad Neon Colors Sheets Pad
CA-2017-132976,Adams n Stick Phone Message Book X Messages
CA-2017-132976,Eldon Simplefile Box Office
CA-2017-132976,Avery
US-2015-161991,Round Binders
US-2015-161991,SoundLink Speaker
CA-2015-130890,Bevis Round Table
CA-2015-130883,staple paper
CA-2015-130883,Microsoft Arc Touch Mouse
CA-2015-130883,Xerox
CA-2016-112697,GBC VeloBinder Electric Machine
CA-2016-112697,Acco Outlet Masterpiece Power Center Fax Phone Line Protection
CA-2016-112697,Premier Letter Opener
CA-2016-110772,Advantus SlideClip Paper Clips
CA-2016-110772,Avery
CA-2016-110772,Logitech Wireless Headset G930
CA-2016-110772,Bush Westfield Collection Bookcases Medium Cherry Finish
CA-2014-111451,Howard Miller Diameter Goldtone Round Wall Clock
CA-2014-111451,Deluxe Office Fabric Chairs
CA-2014-111451,Eldon ClusterMat Chair Mat Cordless Protection
CA-2014-111451,Ibico Laser System Covers
CA-2014-111451,Vinyl Wire Paper Clips Organizer Box Box
CA-2016-142545,Xerox
CA-2016-142545,Tennsco Stur D Stor Boltless Shelves Sand
CA-2016-142545,Xerox
CA-2016-142545,Floodlight Indoor Halogen Bulbs Bulb Pack Watts
CA-2016-142545,Avery Premier Heavy Duty Binder Round Rings
US-2017-152380,BPI Conference Tables
CA-2015-144253,Electrix Halogen Replacement Bulb Zoom Desk Lamp
CA-2014-130960,Newell
CA-2014-111003,GBC Cover x cover pack
CA-2014-111003,Boston Heavy Duty Trimline Electric Pencil Sharpeners
CA-2017-126774,Faber Castell Col Erase Pencils
CA-2016-142902,Line Cubicle Keepers Polyproplyene Holder Velcro Backings
CA-2016-142902,Hon Series Pagoda Armless Chairs
CA-2016-142902,Eldon Expressions Desk Accessory Wood Photo Frame Mahogany
CA-2016-142902,Avery
CA-2014-120887,Deflect SuperTray Tray Letter Black
CA-2014-167850,AT T Phone
CA-2014-167850,Xerox
CA-2014-164259,Boston School Pro Electric Pencil Sharpener
CA-2014-164973,DMI Arturo Collection Mission style Design Wood Chair
CA-2014-164973,Canon imageCLASS MF7460 Monochrome Digital Laser Multifunction Copier
CA-2014-164973,Panasonic Kx TS550
CA-2014-164973,NETGEAR N750 Band Wi Fi Gigabit Router
CA-2014-164973,Trav L File Heavy Duty Shuttle II Black
CA-2014-156601,OIC Binder Clips
CA-2016-162138,Ibico Laser System Covers
CA-2016-162138,Logitech Wireless Headset h800
CA-2017-153339,Floor Lamp
US-2016-141544,Aastra VoIP phone
US-2016-141544,File Shuttle II Handi File Black
US-2016-141544,Hon â Softâ Series Mid Swivel Tilt Chairs
US-2016-141544,Round Specialty Laser Printer Labels
US-2016-141544,GBC Premium Transparent Covers Pattern
US-2016-150147,AT T Phone
US-2016-150147,Ibico Grain Covers
US-2016-150147,Wilson Jones Custom Binder Spines Labels
CA-2015-137946,Storex Dura Pro Binders
CA-2015-137946,Hewlett Packard LaserJet Copier
CA-2015-137946,Avery Non Stick Binders
CA-2014-129924,Tuff Stuff Round Binders
CA-2014-129924,Hon Series Wood Tables
CA-2015-128167,OIC Binder Clips Mini Capacity Black
CA-2014-122336,Newell
CA-2014-122336,Fellowes PB200 Plastic Comb Machine
CA-2014-122336,Staples
CA-2014-122336,Square Credit Card Reader x x White
US-2015-120712,Fellowes Super Stor Drawer
CA-2017-169901,Anker Port USB Wall Charger Travel Power Adapter iPhone
CA-2017-134306,Binney Smith inkTank Desk Highlighter Chisel Tip Box
CA-2017-134306,staple paper
CA-2017-134306,BIC Brite Liner Highlighters Chisel Tip
CA-2016-129714,Sabrent Port USB Hub
CA-2016-129714,Xerox
CA-2016-129714,Acco Data Binders
CA-2016-129714,Xerox
CA-2016-129714,GBC DocuBind P400 Electric System
CA-2016-138520,Sauder Barrister Bookcases
CA-2016-138520,Flap White Envelopes Box
CA-2016-138520,Dixon Prang Watercolor Pencils Color Set Brush
CA-2016-138520,Adams Phone Message Book Message Capacity x
CA-2016-130001,Southworth Cotton Linen Finish Paper Envelopes
CA-2017-155698,Belkin Outlet SurgeMaster II Gold Surge Protector Phone Protection
CA-2017-155698,Avery Address Labels Typewriters x
CA-2017-144904,Avery Address Labels Typewriters x
CA-2017-144904,Managers Chair
CA-2017-144904,Newell
CA-2017-144904,Eldon Desk Accessories
CA-2014-123344,Gould Plastics Pocket Panel Bin x x Black
CA-2016-155516,Wilson Jones â Snapâ Scratch Pad Binder Tool Binders
CA-2016-155516,Staple remover
CA-2016-155516,Pizazz Quick File
CA-2016-155516,Atlantic Metals Mobile Shelf Bookcases Custom Colors
CA-2017-104745,Xerox
CA-2017-104745,File Shuttle Handi File
US-2014-119137,Wilson Jones Custom Binder Spines Labels
US-2014-119137,NETGEAR AC1750 Band GigabitÂ Smart WiFi Router
US-2014-119137,Newell
US-2014-119137,Microsoft Keyboard Elite
US-2016-134656,Xerox
US-2017-134481,Office Impressions End Table H x W x D
CA-2015-130792,Holmes Odor Grabber
CA-2015-130792,Akro Mils Gallon Tote
CA-2015-130792,GBC Twin Loop Wire Elements Spine Black
CA-2016-134775,Southworth Structures Collection
CA-2016-134775,Square Data Binders Pt Covers x
CA-2015-125395,Sony Class Micro SDHC R40 Memory Card
US-2015-168935,Hon Foundations x Training Table Light Gray Charcoal
US-2015-168935,Logitech Media Keyboard K200
CA-2015-122756,Lexmark MarkNet N8150 Wireless Print Server
CA-2015-122756,Hangers Command
CA-2014-115973,Crayola Pencils
CA-2017-101798,Angle D Binders Rings Label Holders
CA-2017-101798,LogitechÂ LS21 Speaker System PC Multimedia CH
US-2014-135972,Nortel M3904 Digital phone
US-2014-135972,Canon PC1080F Copier
US-2014-134971,Wilson Jones Century Plastic Binders
CA-2017-102946,Tuf Vin Binders
CA-2017-165603,Heavy Duty Transfer File Systems Perma
CA-2017-165603,Xerox
CA-2015-122259,Acme Grip Scissors
CA-2016-108987,Super Decoflex File
CA-2016-108987,Riverside Palais Royal Lawyers Bookcase Royale Cherry Finish
CA-2016-108987,Contico H Heavy Duty Storage System
CA-2016-108987,Sony Class Micro SDHC R40 Memory Card
CA-2014-113166,Xerox
CA-2014-155208,Avery Hi Liter EverBold Pen Style Fluorescent Highlighters Pack
CA-2017-117933,Staple holder
CA-2017-117457,Sony Class Micro SDHC R40 Memory Card
CA-2017-117457,Sharp AL Digital Copier
CA-2017-117457,Message Book Page
CA-2017-117457,Bevis Round Conference Table X Base
CA-2017-117457,Service Books x
CA-2017-117457,Self Labels
CA-2017-117457,Xerox
CA-2017-117457,O Sullivan Shelf Bookcase Odessa Pine
CA-2017-117457,Novimex Tech Fabric Mesh Task Chair
CA-2017-142636,Xerox
CA-2017-142636,Deluxe Office Fabric Chairs
CA-2017-122105,Bulldog Vacuum Base Pencil Sharpener
CA-2016-148796,Bevis Steel Chairs
CA-2017-154816,Xerox
CA-2017-110478,Pencil
CA-2017-110478,White Envelopes White Envelopes Poly Window
CA-2014-142048,KeyTronicÂ Series Â KeyboardÂ Black
CA-2017-125388,Westinghouse Mesh Shade Clip Gooseneck Lamp Black
CA-2017-125388,Crate Files
CA-2017-155705,Hon Multipurpose Arm Chairs
CA-2017-149160,Coloredge Poster Frame
CA-2017-149160,GBC VeloBinder System
CA-2014-101476,Epson WorkForce WF Printer Copier Scanner
CA-2017-152275,Design Ebony Pencil
US-2016-123750,GBC ProClick Presentation System
US-2016-123750,ImationÂ Secure Hardware USB Flash Drive
US-2016-123750,ImationÂ Secure Hardware USB Flash Drive
US-2016-123750,Woodgrain Magazine Files Perma
CA-2016-127369,Letter Size Cart
US-2014-150574,Tab Post Binder Dividers
US-2014-150574,Belkin QODE FastFit Keyboard
CA-2016-147375,Canon Color ImageCLASS MF8580Cdw Wireless Laser Printer Copier Scanner
CA-2016-147375,Xerox
CA-2017-130043,Xerox
CA-2017-157252,Deluxe Steno Chair
CA-2016-115756,Aluminum Document Frame
CA-2016-115756,Fellowes Bankers Box Staxonsteel Drawer File System
CA-2016-115756,Eldon Mobile Data Cart Trays
CA-2016-115756,Xerox Color Copier Paper x Ream
CA-2016-115756,Office Star Knee Chair
CA-2016-115756,Avery
CA-2017-154214,GE General Life Showcase Floodlight Incandescent Bulbs
CA-2016-166674,Newell
CA-2016-166674,Fellowes Bankers Box Super Stor Drawer
CA-2016-166674,Boston Deluxe Duty Electric Pencil Sharpener
CA-2016-166674,Pencils
CA-2016-166674,Newell
CA-2016-166674,Belkin Grip Candy Sheer Case Cover iPhone
CA-2017-147277,Chromcraft Conference Tables
CA-2017-147277,Deluxe File Drawer
CA-2016-100153,Memorex Mini Travel Drive GB USB Flash Drive
US-2014-110674,Geo Office Task Chair Gray
US-2016-157945,Hon Series Mobuis Mid Task Chairs Arms
US-2016-157945,Staple envelope
CA-2015-109638,Office Air Cleaner
CA-2015-109638,Logitech G700s Mouse
CA-2015-109638,Acco D Binder w DublLock
CA-2016-109869,Eldon Desk Accessories
CA-2016-109869,Bush Advantage Collection Racetrack Conference Table
CA-2016-109869,Poly Designer Cover
CA-2016-109869,Premier Electric Letter Opener
CA-2016-109869,Fellowes Premier Surge Suppressor Outlet Phone
US-2015-101399,Eldon ClusterMat Chair Mat Cordless Protection
CA-2017-154907,Bush Mission Pointe
US-2016-100419,CD Pocket
CA-2015-154144,Eaton Premium Feed Paper Cotton Letter Size White Shts Box
CA-2014-144666,SAFCO Boltless Steel
CA-2014-144666,Sauder Mission Doors Fruitwood Finish
CA-2014-144666,Samsung Galaxy Note
CA-2014-144666,Decoflex Folder File Blue
CA-2014-144666,Desk Saver Line Book X
CA-2014-144666,Xerox
CA-2016-103891,Cisco SPA525G2 IP Phone Wireless
CA-2016-152632,Electrix Halogen Replacement Bulb Zoom Desk Lamp
CA-2016-100790,Prang Pencils
CA-2016-100790,Fellowes Business Drawer File Letter Size
CA-2014-134677,ImationÂ USB SwivelÂ Flash DriveÂ USBÂ flash driveÂ GB
CA-2014-127691,Premium Pencils Association
CA-2014-127691,Logitech G602 Wireless Mouse
CA-2017-140963,Labels Tab
CA-2017-140963,O Sullivan Dimensions Shelf Bookcases
CA-2017-140963,iHome FM Clock Radio Dock
CA-2014-154627,Apple iPhone
CA-2014-133753,Square Credit Card Reader
CA-2014-133753,Logitech M510 Wireless Mouse
CA-2014-133753,Boston Deluxe Duty Electric Pencil Sharpener
CA-2014-113362,Fellowes Officeware Wire
CA-2014-113362,Envelopes
CA-2016-169166,Sony Micro Vault Click GB USB Flash Drive
US-2016-120929,Balt Wood Table
CA-2015-134782,Strathmore Envelopes Ultimate White
CA-2016-126158,Mylar Strips
CA-2016-126158,Howard Miller Diameter Chrome Round Wall Clock
CA-2016-126158,DMI Arturo Collection Mission style Design Wood Chair
CA-2016-126158,Deflect O Glasstique Desk Accessories
US-2016-105578,Vinyl Post Binders
US-2016-105578,GBC Standard Therm Covers
US-2016-105578,Troy Executive Leather Tilter
US-2016-105578,Storex Poly Binders Pockets
US-2016-105578,White Perf Computer Printout Paper Sheets Part Heavyweight lb x
CA-2017-134978,Avery Slant Binders Labels
CA-2015-145352,Rogers Handheld Barrel Pencil Sharpener
CA-2015-145352,Newell
CA-2015-145352,File Boxes Fold Carry
CA-2015-145352,Fellowes PB500 Electric Punch Plastic Comb Machine
CA-2017-135307,Executive Impressions Supervisor Wall Clock
CA-2017-135307,SanDisk Cruzer GB USB Flash Drive
CA-2016-106341,Premium Pencils Association
CA-2017-163405,Newell
CA-2017-163405,Newell
CA-2017-127432,Canon Image Class D660 Copier
CA-2017-127432,Advantus Storage Box
CA-2017-127432,Great White Multi Use Paper Bright
CA-2017-127432,Tennsco Single Tier Lockers
CA-2015-157812,Verbatim GB Blu ray Single Layer Disc Pack
CA-2015-157812,Carina Media Storage Towers Black
CA-2015-157812,XtraLife ClearVue Slant D Binders
CA-2017-145142,Balt Wood Table
US-2016-139486,Motorola HK250 Universal Headset
US-2016-139486,ImationÂ Mini TravelDrive USB Flash Drive
CA-2015-158792,Staples
CA-2017-113558,Commerce Series Swivel Tilt Chairs
CA-2017-113558,Eldon Expressions Desk Accessory Wood Photo Frame Mahogany
US-2015-138303,Eldon Gobal File Keepers
US-2015-138303,Martin Yale Chadless Opener Electric Letter Opener
US-2015-138303,White Business Envelopes Seam White Business Envelopes
CA-2015-102848,Safco Chairs
US-2017-129441,Tenex Chairmats Use Floors
CA-2016-168753,Panasonic KX TG9471B
CA-2016-168753,Presstex Binders
CA-2016-126613,Sterilite Officeware File Box
US-2017-122637,Premier Binder Black
CA-2015-147851,Poly Pocket Divider Pockets Binders
CA-2015-134894,Eureka Cordless Stick Vac
CA-2015-134894,Situations Chairs Set
CA-2014-140795,Enermax Aurora Lite Keyboard
CA-2016-136924,LG Electronics Tone HBS Headset
US-2015-120161,Fellowes Officeware Wire
CA-2014-103849,SanDisk Cruzer GB USB Flash Drive
CA-2014-103849,Xblue XB X16 SmallÂ Office TelephoneÂ Titanium
CA-2014-103849,Deflect EconoMat Bevel Mat Pile
CA-2017-162929,Avery Plastic Tabs
CA-2017-162929,Xerox
CA-2015-113173,Home Office File Carts
CA-2015-113173,Leather Collection Binder
CA-2015-113173,Staple remover
CA-2016-136406,HON Series Task Chairs Tall
CA-2017-112774,Howard Miller Diameter Grantwood Wall Clock
CA-2017-101945,Advantus T Pin Paper Clips
CA-2017-100650,Tennsco Compartment Lockers Coat Rack
CA-2014-155852,Zebra Zazzle Fluorescent Highlighters
CA-2016-113243,Avery
CA-2016-113243,Bretford â Timeâ Height Multi Task Work Tables
CA-2016-113243,Xerox
CA-2017-118731,Coloredge Poster Frame
CA-2017-118731,GBC Paper Hole Systems lb
