OrderID,GenProductName
CA-2017-122035,Foot Cube Office Refrigerators
CA-2017-122035,Avery Plastic Tabs
CA-2017-122035,Novimex Fabric Task Chair
CA-2017-122035,Slant D Binders
CA-2017-122035,Logitech G35 Channel Surround Sound Headset
CA-2015-117828,Belkin Surge Master II outlet surge protector
CA-2017-165491,ImationÂ SecureÂ DriveÂ Hardware USBÂ flash driveÂ GB
CA-2015-109470,Tuf Vin Binders
CA-2015-109470,GBC Cover x cover pack
CA-2015-109470,Aluminum Screw Posts
CA-2015-109470,Ibico Plastic Combs
CA-2015-105102,GBC Twin Loop Wire Elements
CA-2015-105102,Bush Westfield Collection Bookcases Medium Cherry Finish
CA-2015-105102,Xerox
CA-2017-138422,Wausau Papers Astrobrights Envelopes
US-2015-147739,Tenex Computer Chair Mats
CA-2016-155187,Tennsco Lockers Gray
CA-2016-155187,REDIFORM Register X Messages
CA-2017-169285,Eaton Premium Feed Paper Cotton Letter Size White Shts Box
CA-2017-169285,Xerox
CA-2014-140886,Holmes Odor Grabber
CA-2017-152695,Convenience Packs Business Envelopes
CA-2017-152695,Tripp Lite Isotel Outlet Surge Protector Fax Modem Protection
CA-2014-110639,Xerox
CA-2014-110639,Creations Ink Jet Cards Labels
CA-2014-121727,Turquoise Lead Holder Pocket Clip
CA-2016-137736,Newell
US-2014-143231,Nu Dell Executive Frame
US-2014-143231,ImationÂ SecureÂ DriveÂ Hardware USBÂ flash driveÂ GB
US-2014-155894,Belkin Equipment Shelf Black
CA-2016-119025,Belkin Outlet SurgeMaster Power Centers
CA-2016-159373,TOPS Carbonless Receipt Book x Money Receipts Page
CA-2016-159373,Tab Indexes Data Binders
CA-2016-159373,Hon Non Utility Tables
CA-2017-109701,ring staple pack
CA-2017-109701,Satellite Post Binders
CA-2017-109701,Message Book Page
CA-2017-109701,Fellowes Advanced Computer Series Surge Protectors
CA-2017-109701,Prang Dustless Chalk Sticks
CA-2015-111514,Atlantic Metals Mobile Shelf Bookcases Custom Colors
CA-2015-111514,GBC Prestige Therm Covers
CA-2015-111514,Memorex Micro Travel Drive GB
CA-2015-111514,Lexmark S315 Color Inkjet Printer
US-2014-148838,Bretford Conference Table Tops
US-2014-148838,Balt Wood Round Tables
US-2014-148838,Hon x Table Drawer
US-2014-148838,Xerox
US-2014-148838,Xerox
CA-2017-136497,SpineVue Slant D Binders
US-2016-108637,Howard Miller Diameter Chrome Round Wall Clock
US-2016-108637,Eureka Lite Amp Upright Vacuum Blue
US-2016-108637,Ibico Covers Plastic Wire Elements
CA-2014-102295,Leather Oak Executive Chair Burgundy
CA-2017-123659,HP Office Paper Bright
US-2016-129469,Rubbermaid ClusterMat Chairmats Mat Size x Lip x Degree Angle
US-2016-129469,Dixon Ticonderoga Maple Cedar Pencil
CA-2017-155152,Hypercom P1300 Pinpad
CA-2016-159940,Face Poster Frame
CA-2016-159940,Acco Hot Clips Clips
CA-2016-159940,Tops Message Log Books
CA-2016-159940,Managers Chair
CA-2017-119669,Boxed Rubber Bands
US-2014-164616,GBC DocuBind P50 Machine
US-2014-164616,Acme Kleencut Steel Scissors
CA-2015-148628,Message Book Phone Standard Line Memo X
CA-2016-118052,Advantus T Pin Paper Clips
CA-2016-118052,Xerox
CA-2016-118052,DAX Wood Frames
US-2017-117534,Acco Smartsocket Color Six Outlet AC Adapter Model Surge Protectors
US-2017-117534,Staples misc color
US-2017-117534,Avery Arch Binders
US-2017-117534,Clearsounds A400
US-2017-117534,Hewlett Packard Color Digital Copier
CA-2015-145065,Staples
CA-2015-145065,Premium Regency Composition Covers
US-2015-127040,Xerox
US-2015-127040,Xerox
US-2015-127040,LogitechÂ VX Revolution Cordless Laser Mouse Notebooks Black
US-2015-127040,Seth Thomas Day Date Wall Clock
CA-2016-128111,Newell
CA-2015-137897,ImationÂ Clip USBÂ flash driveÂ GB
CA-2015-137897,ImationÂ Pocket Pro USB Flash DriveÂ GB Black P
CA-2015-137897,Hot Message Books Stickers x
CA-2017-169264,Avery File Folder Labels
CA-2017-169264,Newell
CA-2017-147361,Fellowes Officeware Wire
CA-2017-147361,X Rack File Folders
CA-2017-145877,Folder File
CA-2017-145877,Staple envelope
US-2016-110170,O Sullivan Plantations Door Landvery Oak
CA-2017-108574,Logitech G19 Keyboard
CA-2017-108574,Motorola HK250 Universal Headset
CA-2017-108574,Square Credit Card Reader x x White
CA-2017-144589,Staples misc color
CA-2017-144589,Panasonic KX TG9541B DECT Digital Line Cordless Phone Digital System
CA-2017-155985,DAX Wood Tone Poster Frame
CA-2014-162684,Acco Clips Binder Clips Clips Sizes
CA-2015-142041,ring staple pack
CA-2014-151295,Xerox
CA-2014-151295,Bevis Boat Conference Table
CA-2016-156300,Leather Oak Executive Chair Burgundy
CA-2015-146087,Bush Mission Pointe
CA-2017-168655,WD Passport Ultra Hard Drive
CA-2017-168655,GBC Twin Loop Wire Elements
CA-2016-107202,Panasonic KX MB2061 Multifunction Printer
CA-2017-159597,Safco Wire Cube System Use Cubes Black
CA-2017-159597,Razer Kraken Surround Sound Ear USB Headset
CA-2016-155551,Safco Industrial Wire
CA-2016-155551,Adams Telephone Message Books x
US-2017-147669,Maxell DVD R
US-2017-147669,Satellite Post Binders
US-2017-147669,Hon Conference Tables
US-2017-147669,Staples
CA-2016-169922,Computer Printout Index Tabs
CA-2016-169922,GBC Wire Combs
CA-2016-169922,Tray Side Smoke
CA-2017-100748,Self Address Labels Typewriters Universal
CA-2017-129805,Hangers Command
CA-2014-148586,Iceberg Chair x x
US-2017-112613,Spigen Samsung Galaxy S5 Case Wallet
CA-2015-154746,Brown Kraft Envelopes
CA-2015-154746,Honeywell Enviracaire HEPA Air Cleaner x Room
CA-2017-140053,Tenex Chairmats Medium Pile Carpet Standard Lip x
CA-2014-164210,Bevis Conference Tables
CA-2014-164210,Geographics Note Cards Blank White x
CA-2017-139948,Line Cubicle Keepers Polypropylene
CA-2016-146934,AT T Phone
CA-2016-146934,Bevis x Conference Tables
CA-2016-146934,Eureka Sanitaire Upright
CA-2016-146934,SanDisk Cruzer GB USB Flash Drive
CA-2016-146934,Ampad Peel Seel Holiday Envelopes
CA-2016-146934,Digium D40 VoIP phone
CA-2015-100573,x Envelopes
CA-2016-119165,Hon Olson Stacker Stools
CA-2015-128027,Fellowes Officeware Wire
CA-2016-140207,Holdit Data Disk Pockets
CA-2017-140949,Avery
CA-2017-140949,Cisco SPA525G2 IP Phone Wireless
CA-2017-140949,Acco Pressboard Covers Storage Hooks x Executive
CA-2017-140949,SanDisk Cruzer GB USB Flash Drive
CA-2017-140949,Kingston Digital DataTraveler USB
CA-2017-140949,Neat Ideas Folder Files Black
CA-2017-140949,Avery
CA-2017-140949,Lumber Crayons
CA-2017-140949,Tenex File Box Tote Lid Black
CA-2017-138548,Fellowes Premier Surge Suppressor Outlet Phone
CA-2015-142419,Xerox
CA-2015-142419,Wilson Jones Ledger Size Piano Hinge Binder Blue
CA-2017-148691,GBC Premium Transparent Covers Pattern
CA-2017-148691,SpineVue Slant D Binders
CA-2017-148691,AT T phone
CA-2017-148691,Avery
CA-2017-128755,Black Print Carbonless Snap Letter x
CA-2017-128755,Letter Size Cart
CA-2017-128755,Xerox
CA-2017-128755,Tenex Self Standard File Box Black Gray
US-2016-135923,Eldon Pizzaz Desk Accessories
US-2016-135923,Sauder Hills Woodland Oak Finish
US-2016-135923,Fellowes Mighty Surge Protector
CA-2016-114972,Deluxe Office Chair Storm
CA-2016-114972,Kensington K72356US Mouse Box USB Desktop Mouse
CA-2016-114972,Avery
CA-2016-114972,Honeywell Enviracaire HEPA Air Cleaner x Room
CA-2017-102750,Chromcraft Bull Nose Wood Oval Conference Tables Bases
CA-2014-145212,Newell
CA-2017-141992,Fiskars Spring Action Scissors
CA-2017-141992,Safco Industrial Wire
CA-2017-147956,Office Impressions Heavy Duty Multimedia Storage Drawers
CA-2017-126067,Anker Micro USB Car Charger
CA-2017-126067,Hon Foundations x Training Table Light Gray Charcoal
CA-2017-126067,GBC Standard Therm Covers
CA-2017-126067,Newell
CA-2015-104514,SAFCO Mobile Desk Side File Wire Frame
CA-2015-104514,Newell
CA-2015-104514,Xerox
CA-2015-141040,Jawbone JAMBOX Wireless Speaker
CA-2015-141040,Xerox
CA-2014-113579,White GlueTop Scratch Pads
CA-2014-144624,Apple iPhone
CA-2016-146206,KI Height Table
CA-2016-146206,Polycom VVX VoIP phone
CA-2014-136644,Geo Office Task Chair Gray
CA-2015-122371,Sortfiler Multipurpose File Organizer Black
CA-2015-122371,Cameo Buff Policy Envelopes
CA-2016-126935,GBC VeloBind Strips
US-2017-133781,White Business Envelopes x
CA-2017-131618,Rediform Phone Memo Message Book x
CA-2017-131618,Avery Binders
CA-2017-131618,Fellowes Cases
CA-2016-149482,Avery
CA-2014-143917,Fellowes Folder Files Navy
CA-2014-143917,Speed Electric Letter Opener
CA-2014-143917,Staple wall
CA-2015-120397,Belkin Outlet Surge Protector
CA-2017-163902,Panasonic KX TS3282B phone
CA-2017-163902,Logitech G13 Gameboard LCD Display
CA-2016-136812,Tennsco Snap Units Starter Sets Units
CA-2015-102722,Memorex Froggy Flash Drive GB
CA-2017-155089,Premier Binder Black
CA-2016-124506,Belkin F8E887 USB Keyboard
CA-2016-124506,Chrome Stack Chair
CA-2014-106572,Economy Files
CA-2014-128888,Ames Color File Diamond Border X ray Mailers
CA-2017-123134,Eldon Advantage Chair Mats Medium Pile Carpets
CA-2016-124352,Avery
CA-2016-124352,Avery
CA-2016-124352,Hoover Upright Vacuum Dirt Cup
CA-2016-124352,Xerox
CA-2016-124352,Samsung Replacement EH64AVFWE Premium Headset
CA-2016-124352,Ibico Plastic Combs
CA-2015-124541,Newell
CA-2015-124541,Maxell DVD RW Pack
CA-2015-124541,Ibico Covers Plastic Wire Elements
CA-2015-124541,Fellowes Twister Kit Gray pkg
CA-2015-124541,Xerox
CA-2014-108707,Xerox
CA-2014-111500,Xerox
CA-2014-111500,Avery Non Stick Binders
CA-2014-111500,Push Pins
CA-2014-111500,LogitechÂ G510s Keyboard
US-2017-117723,Tennsco Single Tier Lockers
CA-2015-143238,Memorex Mini Travel Drive GB USB Flash Drive
CA-2015-168746,Leather Manager Chair
CA-2015-168746,Polycom VVX VoIP phone
CA-2015-168746,Nortel M5316 Digital phone
CA-2015-113404,Hon â Softâ Series Mid Swivel Tilt Chairs
CA-2015-113404,Hon Series Pagoda Armless Chairs
CA-2016-144792,Diameter Round Wall Clock
CA-2014-164385,Belkin Outlet SurgeMaster II Gold Surge Protector
US-2016-114174,Bush Westfield Collection Bookcases Dark Cherry Finish
US-2016-114174,Avery
CA-2017-108070,Belkin Equipment Shelf Black
CA-2017-108070,O Sullivan Dimensions Shelf Bookcases
US-2015-128090,Newell
US-2015-128090,Samsung Galaxy S4 Mini
US-2015-128090,Xerox
US-2015-128090,Avery
CA-2017-101042,Task Lamp Clamp Arm Light Gray
CA-2017-101042,GBC Covers
CA-2016-155439,Xerox
CA-2016-118626,HTC Mini
CA-2015-111458,Dell Slim USB Multimedia Keyboard
US-2016-126844,Wood Metal Frame
US-2015-112508,Eureka Sanitaire Multi Pro Heavy Duty Upright Bags
CA-2015-147788,O Sullivan Dimensions Shelf Bookcases
CA-2015-147788,Self Labels
CA-2015-147788,Fellowes Super Stor Drawer Files
CA-2015-144288,Avery
CA-2015-144288,Xerox
CA-2015-110632,KeyTronicÂ KT800P2 Â KeyboardÂ Black
CA-2015-110632,Tenex Self Standard File Box Black Gray
CA-2017-109589,Memorex Froggy Flash Drive GB
CA-2017-123967,GBC Standard Plastic Systems Combs
CA-2017-123967,Hon Series Round Tables
CA-2017-148929,Advantus Drawer Organizer Chrome Metal Frame Smoke Drawers
CA-2017-134404,AT T phone
CA-2017-134404,BIC Brite Liner Highlighters
CA-2017-109778,Crayola Anti Dust Chalk Pack
CA-2016-155845,Logitech diNovo Edge Keyboard
CA-2017-145128,Eldon Chair Mats Medium Pile Carpets
CA-2014-129091,Fashion Color Clasp Envelopes
CA-2014-129091,GBC ProClick Punch System
CA-2014-129091,Staple envelope
CA-2014-129091,Holmes Harmony HEPA Air Purifier x Room
US-2014-155502,GE General Use Halogen Bulbs Watts Bulb Pack
US-2014-155502,SAFCO Wire
US-2014-155502,Eureka Copy Paper x Ream
US-2014-155502,REDIFORM Register X Messages
US-2014-155502,Suction Cup Mount
US-2014-155502,Eldon Image Series Black Desk Accessories
US-2014-155502,Jabra SPEAK
CA-2015-121041,Flap White Envelopes Box
CA-2017-131695,Steel Tote
CA-2017-131695,Executive Impressions
CA-2016-137729,Perma STOR File Box W x D x H
CA-2016-137729,Cisco Small Business SPA VoIP phone
US-2016-115455,Executive Impressions Wall Clock
US-2016-115455,Bretford CR8500 Series Room Furniture
CA-2017-128300,Motorla HX550 Universal Headset
CA-2017-128300,Wilson Jones Ledger Size Piano Hinge Binder Blue
CA-2017-149048,Tyvek Side Peel Seel Envelopes
CA-2017-149048,Ibico Hi Tech System
CA-2017-149048,Plantronics Calisto P620 M USB Wireless Speakerphone System
CA-2017-149048,Tennsco Compartment Lockers
CA-2017-149048,Hammermill CopyPlus Copy Paper Bright
CA-2017-108553,Tripp Lite Isotel Outlet Surge Protector Fax Modem Protection
CA-2017-108553,Acme Grip Scissors
CA-2016-165848,staple paper
CA-2016-165848,Panasonic KX MC6040 Color Laser Multifunction Printer
CA-2016-165848,Sauder Inglewood Bookcases
CA-2016-165848,Linden Round Wall Clock Black
CA-2014-112718,Avery Binder Labels
CA-2016-154053,Berol Giant Pencil Sharpener
CA-2014-127446,KeyTronicÂ KT400U2 Â KeyboardÂ Black
CA-2014-127446,Avery
CA-2014-127446,Bretford CR4500 Series Slim Table
CA-2014-127446,Avery
CA-2014-127446,Southworth Cotton Granite Paper Envelopes
CA-2014-127446,Master Caster Door Brown
CA-2016-137204,Stack Chair Arms Black
CA-2014-147298,Bevis Steel Chairs
CA-2014-147298,Acco Pressboard Covers Storage Hooks x Executive
CA-2017-147942,Avery
CA-2017-147942,Fellowes Cases
CA-2017-115931,Design Ebony Pencil
CA-2017-115931,iKross Keyboard Cell Phone Stand Holder Brush Apple iPhone
CA-2017-115931,Eldon Simplefile Box Office
CA-2017-115931,Avery
CA-2014-164861,Xerox
CA-2017-127180,Canon imageCLASS Advanced Copier
CA-2017-127180,Polycom CX600 IP Phone VoIP phone
CA-2017-127180,Globe Weis Peel Seel Class Envelopes
CA-2017-127180,Sound Power mAh
US-2017-165344,SanDisk Cruzer GB USB Flash Drive
US-2017-165344,Epson TM T88V Thermal Printer Monochrome Desktop
US-2017-165344,Poly Binders
CA-2015-168186,Xerox
US-2017-110604,Hour Round Wall Clock
US-2017-110604,SAFCO Arm Kit Workspace Cribbage Chair
US-2017-110604,SAFCO Arco Chair
CA-2015-116750,Trays
CA-2015-116750,Wilson Jones Turn Tabs Binder Tool Binders
CA-2015-162369,Fellowes Super Stor Drawer Files
CA-2017-108441,TOPS Voice Message Log Book Flash Format
CA-2017-108441,Angle D Binders
CA-2017-108441,Boston StandUp Electric Pencil Sharpener
CA-2017-108441,Safco Chairs
CA-2015-169740,Anker Wireless Keyboard Aluminum Cover Stand
CA-2016-124051,White Computer Printout Paper Universal
CA-2016-149111,Motorola L804
CA-2016-149111,GE General Life Showcase Floodlight Incandescent Bulbs
CA-2014-131002,Executive Impressions Clairmont Wall Clock
CA-2014-131002,GBC Laser System Covers Desert Sand
CA-2014-131002,Xerox
CA-2014-131002,Task Lamp Clamp Arm Light Gray
CA-2014-131002,Plantronics CordlessÂ Phone HeadsetÂ line Volume M214C
US-2016-146794,Bestar Bookcase
CA-2017-112515,Avery Non Stick Binders
CA-2017-112515,Acco Pressboard Covers Storage Hooks x Light Blue
CA-2017-112515,Bar Computer Printout Paper
CA-2017-112515,Adaptabilites Bookcase Cherry Storm Gray Finish
CA-2017-112515,GBC Pre Paper Plastic White x
CA-2017-112515,Mini Capacity Data Binder Rack Pearl
CA-2017-112515,Avery
CA-2016-150343,Convenience Packs Business Envelopes
CA-2015-135538,SAFCO Arco Chair
CA-2017-123372,Google Nexus
CA-2017-123372,Blue Tie Button Interoffice Envelopes x
CA-2017-159604,Acco Hole Punch
CA-2016-164784,Avery
CA-2016-164784,Bevis x Conference Tables
CA-2016-164784,Newell Hole Plastic Magazine Holders Binders
CA-2016-111794,ImationÂ Mini TravelDrive USB Flash Drive
CA-2016-111794,staple paper
US-2015-139759,Deluxe Chair Gray
US-2015-139759,Fellowes Advanced Computer Series Surge Protectors
CA-2014-126403,Xerox
CA-2014-126403,Leather Office Chair
CA-2014-126403,Advantus Note Cards
CA-2014-126403,Tennsco Compartment Lockers
CA-2017-136875,Xerox
CA-2017-132185,Pencil Crayon Sharpener
CA-2017-132185,Belkin Outlet SurgeMaster Power Centers
US-2014-160780,Wilson Jones DublLock Binders
US-2014-160780,Avery Trapezoid Heavy Duty Binders
CA-2017-127026,Avery Binders
CA-2017-127026,Logitech G19 Keyboard
CA-2017-127026,Avery Flip Chart Easel Binder Black
CA-2017-127026,R S IRISCard Card Scanner
CA-2017-127026,Ativa D5772 Line Digital Cordless Phone System Caller ID Black Silver
CA-2017-137085,Satellite Post Binders
CA-2016-133123,Blue Tie Button Interoffice Envelopes x
CA-2016-133123,Pressboard Data Binders Wilson Jones
US-2016-128195,Ibico Presentation Index Systems
CA-2015-153220,Adams Message Pads
CA-2014-123064,BIC Brite Liner Grip Highlighters
CA-2017-156412,Storex Dura Pro Binders
US-2016-144211,x Forms Page Sets Book
US-2016-144211,AT T Lendline Telephone
CA-2016-138079,Contract Clock Brown
CA-2014-143182,Executive Impressions Clairmont Wall Clock
CA-2016-161662,Xerox
CA-2014-145317,Hewlett Packard Deskjet Color Inkjet Printer
CA-2014-145317,Cisco TelePresence System EX90 Unit
CA-2014-145317,Xerox
CA-2014-145317,Avery Fluorescent Highlighter Color Set
CA-2014-145317,Executive Impressions Clairmont Wall Clock
CA-2014-145317,Staples
CA-2014-145317,Dana Fluorescent Lamp White
CA-2014-143413,Xerox
CA-2017-156818,SanDisk Ultra GB MicroSDHC Class Memory Card
CA-2017-155873,Acme Elite Stainless Steel Scissors
CA-2017-155873,Xerox
CA-2017-155873,Xerox
CA-2015-121797,Computer Room Manger
CA-2015-121797,Bady BDG101FRU Card Printer
US-2015-120572,Acco D Binder w DublLock
CA-2017-132430,Nu Dell Leatherette Frames
CA-2017-146031,Sanford Liquid Accent Highlighters
CA-2014-110100,AT T CL2909
CA-2015-103723,Prang Pencil Set
CA-2014-127187,Plantronics Voyager Pro HD Headset
CA-2017-128475,Sony Class Micro SDHC R40 Memory Card
CA-2014-100006,AT T EL51110 DECT
CA-2017-144827,Fellowes Mobile File Cart Black
CA-2014-110030,Diameter Round Wall Clock
CA-2014-121286,OIC Bulk Pack Metal Binder Clips
CA-2014-121286,Acco Outlet Premium Surge Suppressor
CA-2016-164735,Acco Perma Storage Drawers
CA-2014-153479,Avery
CA-2014-153479,GBC Regency Composition Covers
CA-2017-149888,Jabra Supreme Driver EditionÂ Headset
CA-2017-149888,Bevis Conference Tables
CA-2017-119193,Angle D Binders
CA-2017-119193,Panasonic KX TG9541B DECT Digital Line Cordless Phone Digital System
CA-2017-104801,Newell
CA-2017-104801,Razer Tiamat Ear Surround Sound PC Headset
CA-2017-104801,Tenex Contur Chairmats Medium Pile Carpet Computer x
CA-2014-107594,Logitech B530 USBÂ HeadsetÂ Â headsetÂ Full size
CA-2014-107594,DIXON Ticonderoga Pencils
CA-2015-129770,staple paper
CA-2015-115798,BlackBerry Q10
CA-2015-115798,Adams Telephone Message Books x
CA-2015-115798,Bestar Bookcase
CA-2015-115798,Innergie mMini Combo Duo USB Travel Kit
CA-2017-122707,Electric Letter Opener
CA-2017-122707,SanDisk Ultra GB MicroSDHC Class Memory Card
CA-2016-165015,Staple envelope
CA-2014-149244,Executive Impressions Wall Clock
CA-2015-140144,Howard Miller Diameter Pewter Finish Round Wall Clock
CA-2015-140144,netTALK DUO VoIP Telephone Service
CA-2017-163321,Logitech G700s Mouse
CA-2014-155887,Bevis Conference Table Plinth Base
US-2015-165449,SanDisk Cruzer GB USB Flash Drive
CA-2015-110247,SpineVue Slant D Binders
US-2014-141257,Hon Deluxe Fabric Chairs
CA-2014-154669,Advantus Drawer Organizers
CA-2014-158029,Hon Olson Stacker Stools
CA-2015-155306,Prang Pencil Set
CA-2015-155306,Plantronics S12 Telephone Headset System
CA-2015-155306,Plantronics Calisto P620 M USB Wireless Speakerphone System
CA-2015-155306,Hoover Upright Vacuum Dirt Cup
CA-2015-155306,Xerox
CA-2016-127775,Razer Kraken Ear PC Headset
CA-2016-146171,Executive Impressions Clairmont Wall Clock
CA-2016-146171,Iceberg Mobile Data Printer Cart
CA-2014-129574,Service Books x
CA-2017-126536,Maxell DVD R Pack
CA-2017-126536,Canvas Post Binders
CA-2017-165757,GBC Covers
CA-2017-165757,Wilson Jones Century Plastic Binders
CA-2017-165757,Plastic Crates Casters
CA-2017-167752,Belkin F9M820V08 Outlet Surge
CA-2017-167752,Honeywell Enviracaire HEPA Air Cleaner x Room
US-2015-122140,APC Outlet Network Surge Protector
US-2015-122140,Kingston Digital DataTraveler USB
US-2015-122140,Anker Ultra Slim Mini Wireless Keyboard
CA-2016-163986,Crate Files
CA-2017-158967,Staple wall
CA-2016-131576,Ibico Standard Transparent Covers
CA-2017-143455,Xerox
CA-2016-144729,Belkin Equipment Shelf Black
CA-2015-127019,Belkin Outlet Surge Strip
CA-2015-138534,Sauder Camden County Collection Libraries Cherry Finish
CA-2017-108322,Hangers Command
CA-2017-108322,Maxell DVD R Pack
CA-2017-167668,Avery
CA-2017-146724,Sanford Uni Blazer View Highlighters Chisel Tip
CA-2016-139878,Digium D40 VoIP phone
US-2016-106677,Anker Astro Mini Ultra Charger
CA-2016-116974,Mediabridge Sport Armband iPhone
CA-2015-149972,Hon Day Series Multi Task Chairs
CA-2015-149972,Advantus Map Pennant Flags Round Head Tacks
US-2014-117744,Deflect SuperTray Tray Letter Black
US-2014-117744,Newell
US-2014-117744,Diameter Round Wall Clock
CA-2014-125514,Fellowes Home Office Series Surge Protectors
CA-2014-125514,Acco Outlet Standard Surge Suppressor
CA-2014-125514,Xerox
CA-2014-154599,Pyle PMP37LED
CA-2014-154599,AT T phone
CA-2014-154599,Pressboard Report Cover Hinge
CA-2014-154599,O Sullivan Dimensions Shelf Bookcases
CA-2017-158743,Eldon Spacemaker Box Quick Snap Lid
CA-2017-158743,Xerox
CA-2017-158743,Machine Supplies
CA-2016-153318,Panasonic KX TG9471B
US-2015-110163,Lumber Crayons
CA-2017-143329,Diameter Round Wall Clock
CA-2015-159380,Xerox
CA-2015-159380,Xerox
CA-2015-122623,Metal Chairs Beige Carton
CA-2015-148635,Plymouth Boxed Rubber Bands Plymouth
CA-2015-148635,Xerox
CA-2015-148635,Sauder Hills Woodland Oak Finish
CA-2015-148635,Office Star Matrix Chair Synchro Tilt Mesh Fabric Seat
CA-2015-135685,Xerox
CA-2015-135685,Advantus Employee Month Certificate Frame x
CA-2015-135685,Lesro Sheffield Collection Coffee Table End Table Center Table Corner Table
CA-2015-135685,Logitech diNovo Edge Keyboard
CA-2015-135685,Chromcraft Bull Nose Wood Round Conference Table Wood Base
CA-2015-104626,Deluxe Heavy Duty Vinyl Round Binder
CA-2015-104626,Value Steno Chair Gray
CA-2015-104626,Deflect Glass Chair Mats
CA-2015-104626,Depth Letter Cart
CA-2016-160500,Computer Printout Index Tabs
CA-2016-160500,Bevis x Conference Tables
CA-2017-100202,Adtran
CA-2017-131016,Newell
CA-2017-131016,Acco Perma Storage Drawers
US-2014-112914,Xerox
US-2014-112914,O Sullivan Dimensions Shelf Bookcases
US-2014-112914,Avery Self Photo Pockets Polaroid Photos
US-2014-112914,Poly Tie Envelopes
CA-2016-124149,Ink Jet Note Cards
CA-2016-124149,Eldon Fold N Roll Cart System
CA-2016-124149,Xerox
CA-2014-148915,Carina Mini System Audio Rack Model AR050B
CA-2014-148915,Plantronics Voyager Pro HD Headset
CA-2017-134649,Newell
CA-2017-134649,Avery Poly Binder Pockets
CA-2017-110842,Belkin Outlet Surge Strip
CA-2017-110842,Xerox
CA-2017-110842,Ibico Plastic Combs
CA-2016-147368,Cisco CP IP Conference Station Phone
US-2015-104185,Iceberg Mobile Data Printer Cart
US-2014-125521,Commerce Series Swivel Tilt Chairs
US-2017-135062,Xerox
CA-2017-135650,Fellowes Officeware Wire
CA-2017-112865,KeyTronicÂ KT800P2 Â KeyboardÂ Black
US-2016-162852,Manager Task Chair Storm
CA-2017-138163,Stanley Bostitch Electric Pencil Sharpeners
CA-2017-152093,Fellowes PB500 Electric Punch Plastic Comb Machine
CA-2017-157854,Eldon Expressions Metal Wood Desk Accessories Black Cherry
CA-2017-157854,GBC DocuBind TL300 Electric System
CA-2016-123617,ACCOHIDE Binder Acco
US-2016-128293,Carina Media Storage Towers Black
CA-2017-107342,Message Books x Forms Page
CA-2016-136371,GE Foot Flourescent Tube Watt
CA-2016-136371,Master Caster Door Brown
CA-2017-137344,Neat Ideas Folder Files Black
CA-2017-169810,Avery
CA-2016-128594,Troy Executive Leather Tilter
CA-2016-154690,Hon Olson Stacker Stools
CA-2017-138975,Kingston Digital DataTraveler USB
CA-2017-138975,Nokia Lumia
CA-2017-138975,O Sullivan Door Barrister Bookcase Odessa Pine
CA-2017-138975,Xerox
CA-2017-106537,Xerox
US-2017-103828,Sterilite Officeware File Box
US-2017-103828,Staple holder
US-2017-103828,Newell
US-2017-103828,Staple remover
CA-2016-115588,Staple remover
CA-2016-115588,Acco Perma Storage Drawers
CA-2017-143861,Dana Arm Lamps
CA-2014-148040,Xerox
CA-2014-148040,Office Star Mesh Screen chair Vinyl seat
CA-2017-135167,Dixon Prang Watercolor Pencils Color Set Brush
CA-2017-137022,Tennsco Regal Units
US-2017-102638,Ideal Clamps
US-2016-167339,Super Steno Chair
US-2016-167339,Managers Chair
CA-2016-152072,Quality Park Security Envelopes
CA-2016-152072,Pencil
CA-2016-152072,LogitechÂ G510s Keyboard
CA-2016-102932,Storex DuraTech Plastic Binders
CA-2016-102932,Acme Steel Scissors Black Enamel Handles
CA-2014-165540,GBC Standard Plastic Systems Combs
CA-2016-130799,Eldon Regeneration Desk Accessories Smoke
CA-2016-164483,Heavy Duty E Z D Binders
US-2016-159856,Deluxe Steno Chair
CA-2017-102099,Newell
CA-2017-102099,Xerox
CA-2017-102099,Xerox
CA-2017-164049,Message Books x Forms Page Sets Book
CA-2014-142727,Stack Chair Arms Black
CA-2014-142727,Avery Non Stick Heavy Duty View Round Binders
CA-2017-139913,Xerox
CA-2017-139913,Xerox Series MultiUse Premium Copy Paper Bright
CA-2017-139913,Eldon Class Desk Accessories Smoke
CA-2017-139913,Need Hello Kitty Silicone Case Cover HTC X Hello Kitty Stylus Pen pink
CA-2014-169033,Peel China Markers
US-2016-164630,Hewlett Packard Color Digital Copier
US-2015-114839,Hon Series Pagoda Armless Chairs
CA-2015-166464,Hewlett Packard Color Digital Copier
CA-2015-166464,Avery
CA-2017-124898,Xerox
CA-2016-164035,Xerox
CA-2016-153577,Message Books x White Forms Page
CA-2016-153577,Commerce Series Swivel Tilt Chairs
CA-2014-127586,Level Single Width Carts
CA-2017-121615,Xerox
CA-2017-121615,Sterilite Officeware File Box
CA-2017-121615,Avery
CA-2017-166415,Rubber Band Ball
CA-2015-118444,Belkin UPS Surge Protector
CA-2014-113929,Staple envelope
CA-2014-113929,Boston Black Battery Pencil Sharpener
CA-2014-113929,Ibico Standard Transparent Covers
CA-2015-134747,AT T Lendline Telephone
