OrderID,GenProductName
CA-2015-112130,Sanford Prismacolor Thick Lead Art Pencils Color Set
CA-2015-112130,Holmes Replacement Filter HEPA Air Cleaner Room
CA-2015-112130,Xerox
CA-2015-112130,Bravo II Megaboss Amp Hard Body Upright Replacement Belts Belts Pack
CA-2015-112130,SanDisk Cruzer GB USB Flash Drive
CA-2015-112130,Leather Highback Executive Chair Height Adjustment Black
CA-2015-112130,Fellowes Bankers Box Stor Drawer Steel
CA-2016-111409,Avery
CA-2016-116232,Acco Suede Grain Vinyl Round Binder
CA-2016-116232,Avery Address Labels Typewriters x
CA-2016-116547,Hour Round Wall Clock
CA-2016-116547,Logitech Media Keyboard K200
US-2017-133200,Avery Poly Binders
US-2017-133200,Sauder Mission Doors Fruitwood Finish
US-2017-133200,Fellowes Staxonsteel Drawer Files
CA-2016-133550,Honeywell Quietcare HEPA Air Cleaner
CA-2016-133550,ClearOne Communications CHAT OCÂ Speaker Phone
CA-2016-133550,Polycom SoundPoint Pro SE phone
CA-2016-133550,Eldon ClusterMat Chair Mat Cordless Protection
CA-2017-139416,Eldon Expressions Metal Wood Desk Accessories Black Cherry
CA-2014-114510,GBC Wire Combs
CA-2014-114510,Carina Media Storage Towers Black
CA-2014-114510,ImationÂ USBÂ Flash DriveÂ
CA-2014-114510,Staple magnet
CA-2014-114510,Premium Transparent Presentation Covers Pattern x
CA-2016-169215,Acco Hot Clips Clips
CA-2016-127698,Jabra Supreme Driver EditionÂ Headset
CA-2016-159912,Barricks x Non Utility Table Bottom Storage Shelf
CA-2016-159912,O Sullivan Shelf Heavy Duty Bookcases
CA-2016-159912,Fellowes Black Plastic Comb Bindings
CA-2016-159912,Boxed Rubber Bands
CA-2016-101987,Panasonic KX TS208W phone
US-2017-154851,Acco Pressboard Covers Storage Hooks x Executive
CA-2014-138681,Computer Room Manger
CA-2014-138681,Logitech M325 Wireless Mouse Web
CA-2014-138681,Tilter Chair
CA-2014-138681,Xerox
CA-2014-138681,Xerox
US-2015-138121,GBC Plastic Combs
US-2015-138121,Hon Valutask Swivel Chairs
US-2015-138121,Harbour Creations Series Chairs
US-2015-138121,Value Steno Chair Gray
US-2015-138121,Tenex Granite Contour Shape Chair Mats
CA-2017-140298,Newell
CA-2017-140298,Safco
CA-2017-140298,Xerox
CA-2017-140298,Floor Lamp
CA-2016-166240,Holmes HEPA Air Purifier
CA-2016-158435,Acme Steel Scissors Black Enamel Handles
CA-2016-158435,Avery
CA-2016-158435,Eldon Advantage Chair Mats Medium Pile Carpets
CA-2017-138149,GBC DocuBind TL200 Machine
CA-2017-138149,Trav L File Heavy Duty Shuttle II Black
CA-2017-138149,Newell
CA-2017-138149,Enermax Briskie RF Wireless Keyboard Mouse Combo
CA-2014-112403,Avery Round Poly Binders
CA-2014-108273,Xerox
CA-2014-108273,Tenex Granite Contour Shape Chair Mats
CA-2017-121643,Aastra CT Wireless VoIP phone
US-2015-122910,VTech DS6151
CA-2017-143126,Bevis Oval Conference Table Walnut
CA-2015-129042,Rogers Handheld Barrel Pencil Sharpener
CA-2015-109736,Xerox
CA-2015-142601,Tennsco Stur D Stor Boltless Shelves Sand
CA-2015-142601,Xerox
CA-2014-106229,Bevis Round Conference Table X Base
US-2017-135230,Staples misc color
CA-2016-159653,Avery
CA-2016-131968,Ibico Standard Transparent Covers
CA-2016-131968,Sanyo Foot Mid Size Office Refrigerators
CA-2014-119151,Tennsco Snap Units Starter Sets Units
CA-2014-119151,Sauder Camden County Collection Libraries Cherry Finish
CA-2014-123323,Wilson Jones Size Binders
CA-2016-124681,SanDisk Cruzer GB USB Flash Drive
US-2015-103996,Xerox
US-2015-103996,Tops Message Log Books
US-2015-103996,Memorex Froggy Flash Drive GB
US-2015-103996,G E Life Indoor Floodlight Bulbs
CA-2016-120530,Hon Deluxe Fabric Chairs
CA-2015-155054,ACCOHIDE Binder Blue
CA-2015-155054,Easel Binders
CA-2015-155054,Lenovo Key USB Keypad
CA-2015-105725,Avery File Folder Labels Dot Matrix Printers Labels Box White
CA-2015-105725,Hon Series Training Tables
CA-2017-164364,Avery
CA-2017-164364,Dixon Ticonderoga Maple Cedar Pencil
CA-2017-164364,Acme Steel Scissors Black Enamel Handles
CA-2017-168123,Advantus Map Pennant Flags Round Head Tacks
CA-2017-168123,Steel File Standard File Folders
CA-2017-168123,GBC ProClick Punch System
CA-2017-168123,Avery Hole Reinforcements
CA-2016-120005,Elite Scissors
CA-2016-120005,Executive Impressions Spectator Wall Clock
CA-2016-123526,Xerox
CA-2016-127649,Okidata C331dn Printer
CA-2016-159989,ARKON Windshield Dashboard Air Vent Car Mount Holder
CA-2017-103499,Office Star Mesh Screen chair Vinyl seat
US-2015-167220,AmazonBasics Button USB Mouse
CA-2017-126354,GBC Instant Report Kit
CA-2017-126354,x Blue Bar Computer Printout Paper
CA-2017-169817,Tab Indexes Data Binders
US-2017-144582,GBC Linen Covers
CA-2014-121573,Panasonic KX TG9471B
CA-2014-121573,Surelock Post Binders
CA-2014-121573,Acco Pressboard Covers Storage Hooks x Light Blue
CA-2016-117660,Avery
CA-2016-117660,Acme Office Executive Series Stainless Steel Trimmers
CA-2014-112851,Tyvek Interoffice Envelopes x Box
CA-2017-123701,BIC Liqua Brite Liner
CA-2015-118227,BOSTON Ranger Pencil Sharpener Black
CA-2015-123155,Maxell DVD R
CA-2015-123155,Panasonic KX T7736 B Digital phone
CA-2017-158883,Things Today Book
US-2016-114888,Holdit Business Card Pockets
US-2016-114888,Kleencut Office Shears Acme United Corporation
US-2014-167262,Plantronics HL10 Handset Lifter
CA-2017-119746,Wood Metal Frame
CA-2017-119746,Avery File Folder Labels
CA-2017-119746,Toshiba IPT2010 SD IPÂ Telephone
CA-2017-108091,Newell
CA-2016-101630,Staple label
CA-2016-101630,Acme Office Executive Series Stainless Steel Trimmers
CA-2017-132346,Holmes Odor Grabber
CA-2014-150301,Situations Chairs Set
CA-2014-159310,Hon Deluxe Fabric Chairs
CA-2014-159310,Avery Triangle Sheet Lifters Black Pack
CA-2014-159310,Acme Stainless Steel Office Snips
US-2017-147984,Xerox
CA-2015-104346,Newell
CA-2015-104346,Bush Westfield Collection Bookcases Dark Cherry Finish
CA-2015-104346,Newell
CA-2015-104346,Logitech Keyboard K120
CA-2015-104346,Master Caster Door Neon Orange
CA-2015-104346,DAX Wood Document Frame
CA-2015-104346,Bevis Conference Tables
CA-2015-104346,Xerox
CA-2015-104346,Avery Creations Heavyweight Cards
US-2015-141684,Ampad Phone Message Book Message Capacity Â¾â x
CA-2015-144722,Howard Miller Diameter Brentwood Wall Clock
CA-2015-120516,ring staple pack
US-2016-148901,GBC DocuBind P50 Machine
US-2016-148901,Xerox
US-2016-148901,DAX Copper Panel Document Frame x Size
US-2016-148901,LF Elite Dazzle Designer Hard Case Cover Lf Stylus Pen Apple Iphone Mini Lite
US-2016-148901,Dixon Ticonderoga Pencils
US-2016-148901,Wilson Jones International Size A4 Binders
US-2016-148901,Avery Heavy Duty EZD Binder Rings
CA-2017-136364,Cisco SPA508G
CA-2017-136364,Nu Dell Executive Frame
CA-2015-137708,Xerox
CA-2015-137708,Xerox
CA-2015-137708,Folder Holder Ebony
CA-2014-149055,Quality Park Security Envelopes
CA-2015-151589,Xerox
CA-2015-151589,Cisco SPA IP Phone
CA-2016-121370,Managers Chair
CA-2016-121370,Sharp AL Digital Copier
CA-2016-121370,DAX Wood Frame Silver Metal Mat Desktop x Size
CA-2016-111696,Xerox
CA-2014-139598,Message Books x Forms Page
CA-2014-139598,Holmes HEPA Air Purifier
CA-2014-139598,Tripp Lite TLP810NET Broadband Surge Modem Fax
CA-2014-139598,Storage WireTech Storage Systems
CA-2017-117436,Wilson Jones Impact Binders
CA-2015-140025,Hoover Upright Vacuum Dirt Cup
CA-2015-140025,Razer Kraken Ear PC Headset
CA-2016-134222,GBC Standard Therm Covers
CA-2016-140018,Texas Instrument TI Fraction Calculator
CA-2016-140018,Value Steno Chair Gray
CA-2016-140018,Computer Room Manger
US-2017-136707,Acco Hole Punch
CA-2014-152562,Multi Use File Cart Caster Set Bins
CA-2014-152562,OIC Pencils Medium
CA-2016-152408,Binder Posts
CA-2014-120278,Belkin Outlet Surge Protector
CA-2014-120278,File Box
CA-2014-120278,X Rack File Folders
CA-2014-120278,ACCOHIDE Binder Blue
CA-2017-167661,Avery View Binder EZD Navy
CA-2017-167661,Xerox
CA-2017-167661,Avery Hole Reinforcements
CA-2017-106831,HOLDit Binder Insert Strips Strips
CA-2017-106831,Xerox
CA-2017-106831,Panasonic KX TG6844B Digital Cordless Telephone
CA-2017-154123,Diameter Round Wall Clock
CA-2016-136049,Universal Pressboard Report Binders Letter Size
CA-2017-118402,Carina Media Storage Towers Black
US-2016-139388,Rubber Band Ball
US-2014-128685,Avery Non Stick Binders
CA-2015-124044,Acco Hole Punch
CA-2014-164469,Plantronics
CA-2014-164469,Avery Hi Liter EverBold Pen Style Fluorescent Highlighters Pack
CA-2014-164469,Hunt BOSTON Vista Battery Pencil Sharpener Black
CA-2014-107818,Prang Pencils
CA-2014-107818,Hon Deluxe Fabric Chairs
CA-2014-107818,Hunt PowerHouse Electric Pencil Sharpener Blue
CA-2014-107818,Carina Media Storage Towers Black
CA-2014-113320,Eldon Image Series Desk Accessories Burgundy
CA-2014-113320,Woodgrain Magazine Files Perma
CA-2014-113320,Life White Bulbs
CA-2015-137526,Machine Supplies
CA-2015-137526,Floodlight Indoor Halogen Bulbs Bulb Pack Watts
CA-2015-137526,Deflect EconoMat Bevel Mat
CA-2017-136063,Newell
CA-2016-101546,GBC DocuBind TL300 Electric System
CA-2014-138940,Jawbone JAMBOX Wireless Speaker
CA-2016-125164,Canvas Post Binders
CA-2016-125164,Wilson Jones Century Plastic Binders
CA-2017-163531,Mophie Juice Pack Helium iPhone
CA-2017-122490,Troy Executive Leather Tilter
CA-2017-122490,GBC DocuBind P50 Machine
CA-2017-122490,Space Solutions HD Industrial Steel
CA-2017-122490,Avery File Folder Labels
CA-2017-131366,Blue Parrot B250XT Grade Wireless BluetoothÂ HeadsetÂ
CA-2017-131366,Xerox
CA-2017-164042,OIC Thumb Tacks
CA-2017-164042,Acco Outlet Premium Surge Suppressor
CA-2017-164042,Tennsco
CA-2017-164042,Storex Dura Pro Binders
CA-2014-132864,ImationÂ Pocket Pro USB Flash DriveÂ GB Black P
US-2014-155817,Advantus Drawer Organizers
US-2014-155817,DIXON Oriole Pencils
US-2016-131891,Avery Triangle Sheet Lifters Black Pack
CA-2017-143567,Letter Size Poly Tie Envelopes
CA-2017-143567,Hon Deluxe Fabric Chairs
CA-2017-143567,Logitech diNovo Edge Keyboard
CA-2017-143567,Super Decoflex File
CA-2017-104080,Canvas Binder x Sheets
CA-2017-104080,Newell
CA-2014-151379,Xerox
CA-2016-163167,Push Button Manager Chair Indigo
CA-2016-163167,Kingston Digital DataTraveler USB
CA-2016-163167,Tennsco Single Tier Lockers
CA-2016-163167,Capacity Maxi Data Binder Racks Pearl
CA-2016-135776,Newell
CA-2016-135776,Computer Printout Paper Letter Perforations
CA-2016-135776,Sanford EarthWrite Pencils Medium
CA-2016-135776,SAFCO Boltless Steel
CA-2016-135776,Xerox
CA-2016-135776,Staple envelope
CA-2016-135776,Tennsco Snap Units Starter Sets Units
US-2014-122021,Leather Office Chair
US-2014-122021,Xerox
CA-2016-130484,GBC Covers
CA-2017-120936,Iceberg Mobile Data Printer Cart
CA-2017-120936,Fiskars Spring Action Scissors
CA-2017-110884,Organizer Strips
CA-2017-110884,Avery File Folder Labels Dot Matrix Printers Labels Box White
US-2014-161613,Hon Series Pagoda Round Chairs
US-2014-146353,Avery Poly Binders
US-2014-146353,Fellowes Bankers Box Super Stor Drawer
CA-2014-133809,Pressboard Data Binders Unburst Sheets
CA-2014-133809,PNY USB Car Charger Black
CA-2017-127306,x Security Tint Envelopes
CA-2017-127306,Xerox
CA-2017-127306,iHome FM Clock Radio Dock
CA-2017-127306,Ibico Presentation Index Systems
CA-2017-127306,Avery Slant Binders Label Holder
CA-2015-161830,BOSTON Model Electric Pencil Sharpeners Putty Woodgrain
CA-2015-161830,Avery Hole Reinforcements
CA-2017-163125,Bulldog Vacuum Base Pencil Sharpener
CA-2017-163125,Hon Day Chair Series Swivel Task Chairs
CA-2016-160304,Bush Westfield Collection Bookcases Medium Cherry Finish
CA-2016-160304,GE
CA-2017-101728,Binder Posts
CA-2017-114055,x Blue Bar Computer Printout Paper
CA-2017-114055,Color Push Pins
CA-2017-114055,Xerox
CA-2017-114055,AT T Lendline Telephone
CA-2017-126438,Eberhard Faber Golf Pencils
CA-2017-117653,Lesro Round Collection Coffee Table End Table
CA-2017-143245,Xerox
CA-2017-143245,Comet Armless Chair
US-2014-138828,Newell
US-2014-138828,staple paper
CA-2017-143651,Newell
CA-2015-106978,White Business Envelopes x
CA-2015-106978,Wilson Jones Flow II Sheet Lifters
CA-2015-106978,Staples
CA-2015-155124,SmartStand Mobile Device Holder Colors
CA-2017-150931,Wilson Jones Turn Tabs Binder Tool Binders
CA-2014-157147,Tennsco Compartment Lockers
CA-2014-157147,O Sullivan Elevations Bookcase Cherry Finish
CA-2014-157147,Highlighters Sanford
CA-2015-156482,Office Star Swivel Chair Arms Flex
CA-2015-156482,Hon Metal Bookcases Putty
CA-2015-156482,SANFORD Liquid Accent Tank Style Highlighters
CA-2017-106782,Tennsco Single Tier Lockers
CA-2016-151372,x Blue Bar Computer Printout Paper
CA-2016-151372,Angle D Binders Rings Label Holders
CA-2016-151372,Advantus Push Pins
CA-2014-102085,Avery
CA-2017-107125,Premium Transparent Presentation Covers GBC
CA-2017-107125,Eldon Class Desk Accessories
CA-2016-125815,BIC Brite Liner Highlighters
CA-2015-144190,Xerox
CA-2017-117926,Belkin Outlet SurgeMaster II Surge Protectors
CA-2015-153906,Plantronics MX500i Earset
CA-2014-160262,DIXON Oriole Pencils
CA-2014-160262,Xerox
CA-2014-160262,Executive Impressions Indoor Outdoor Wall Clock
CA-2015-127607,GBC Standard Plastic Systems Combs
CA-2015-127607,Staples
CA-2016-166226,Grandstream GXP2100 Mainstream Business Phone
CA-2016-166226,Fellowes Command Center outlet power strip
CA-2014-156587,Push Button Manager Chair Indigo
CA-2014-156587,Newell
CA-2014-156587,Carina Hx23 W Media Storage Unit
CA-2016-141180,GBC Instant Report Kit
CA-2015-109708,Wi Ex zBoost YX540 Phone Signal Booster
CA-2015-122406,Plantronics MX500i Earset
CA-2015-122406,Important Message Pads x Forms Pad
CA-2015-122406,Logitech G700s Mouse
CA-2015-122406,Office Star Flex Scooter Chair White Frame
US-2016-153815,Leather Manager Chair
US-2016-153815,Ink Jet Note Cards
US-2016-153815,Executive Impressions Contract Wall Clock
US-2016-153815,Eaton Premium Feed Paper Cotton Letter Size White Shts Box
CA-2016-164896,x Forms Page Sets Book
CA-2015-142202,Enermax Acrylux Wireless Keyboard
CA-2015-165050,Pressboard Data Binders Wilson Jones
CA-2015-165050,Avery Slant Binders Label Holder
CA-2015-165050,Digium D40 VoIP phone
US-2016-131114,Acme Office Executive Series Stainless Steel Trimmers
US-2016-131114,Belkin Outlet Surge Strip
US-2016-131114,Kingston Digital DataTraveler USB
CA-2014-160066,Permanent Self File Folder Labels Typewriters Universal
CA-2016-109925,Eldon Mobile Manager
CA-2015-160696,Color Push Pins
CA-2014-125171,Avery
CA-2016-149279,Xerox
CA-2016-149279,SAFCO Arco Chair
CA-2016-149279,Wilson Jones Impact Binders
CA-2017-107321,Acco Suede Grain Vinyl Round Binder
CA-2017-107321,Aastra CT Wireless VoIP phone
US-2017-122714,Ibico EPK Electric System
CA-2015-153038,x Envelopes
CA-2015-153038,Avery
CA-2015-153038,Master Caster Door Brown
CA-2014-132227,Acco ACCOHIDE Square Data Binder Dark Blue X
CA-2017-155824,Euro Pro Shark Stick Mini Vacuum
CA-2017-155824,Heavy Duty E Z D Binders
CA-2016-129238,AT T Phone
CA-2016-129238,staple paper
CA-2017-159688,Logitech G600 MMO Mouse
CA-2016-136126,Acme Hot Carbon Steel Scissors Nickel Handles Cut L
CA-2016-136126,Xerox
CA-2016-155033,Astroparche Fine Business Paper
CA-2014-156006,Maxell DVD RW Pack
CA-2015-158659,Letter Size Cart
CA-2015-169796,Zebra ZM400 Thermal Label Printer
CA-2015-169796,Perma STOR File Box W x D x H
CA-2015-102876,GBC Wire Strips
CA-2015-102876,Samsung Galaxy Note
CA-2015-102876,Angle D Binders
US-2017-139647,Bestar Bookcase
US-2017-160465,Vinyl Post Binders
US-2017-160465,Letter Size File
US-2017-160465,Dexim XPower Skin Super Thin Power Case iPhone Black
CA-2014-153850,Eldon Class Desk Accessories Burgundy
CA-2014-153850,Samsung Galaxy S4
CA-2014-127558,Eldon Class Desk Accessories
CA-2014-127558,LogitechÂ P710e Mobile Speakerphone
CA-2014-127558,Acme Box Cutter Scissors
CA-2017-136511,Premier Electric Letter Opener
CA-2016-133795,SanDisk Cruzer GB USB Flash Drive
CA-2016-133795,LogitechÂ P710e Mobile Speakerphone
CA-2016-133795,Eldon Expressions Wood Plastic Desk Accessories Oak
US-2017-130953,GBC Poly Designer Covers
US-2017-130953,Nortel M3904 Digital phone
US-2017-130953,Holmes Replacement Filter HEPA Air Cleaner Room HEPA Filter
US-2017-130953,Office Star Flex Scooter Chair Aluminum Finish Frame
CA-2014-151792,Logitech Wireless Performance Mouse MX PC Mac
CA-2017-139304,Newell
CA-2017-139304,Acme Office Executive Series Stainless Steel Trimmers
CA-2017-139304,Mylar Strips
CA-2016-155166,Novimex Turbo Task Chair
CA-2016-155166,Fellowes Advanced Computer Series Surge Protectors
CA-2015-103954,O Sullivan Cherrywood Estates Barrister Bookcase
CA-2014-169803,Chromcraft Bull Nose Wood Round Conference Table Wood Base
CA-2014-169803,Kingston Digital DataTraveler USB
CA-2017-141719,LogitechÂ Keyboard
CA-2015-136469,Lesro Sheffield Collection Coffee Table End Table Center Table Corner Table
CA-2015-136469,Wilson Electronics DB Pro Signal Booster
CA-2015-136469,Tuf Vin Binders
CA-2016-158694,Ink Jet Note Cards
CA-2016-158694,Belkin F9S820V06 Outlet Surge
CA-2016-158694,Howard Miller Diameter Ridgewood Wall Clock
CA-2016-158694,Xerox
CA-2016-158694,Standard File Lock
CA-2016-158694,Peel Stick Corner Pockets
CA-2016-158694,Newell
US-2014-104759,Fellowes Black Plastic Comb Bindings
US-2014-104759,Kensington SlimBlade Notebook Wireless Mouse Nano Receiver
CA-2015-150511,Message Books x Forms Page Sets Book
CA-2015-134922,White Envelopes White Envelopes Poly Window
US-2017-120607,Tops White Computer Printout Paper
CA-2015-141243,Enermax Acrylux Wireless Keyboard
CA-2015-141243,Newell
CA-2015-141243,O Sullivan Dimensions Shelf Bookcases
CA-2015-162166,Xerox
CA-2015-162166,Eldon Shelf Savers Cubes Bins
CA-2016-120796,GBC Velobind Cover Sets Regency Series
CA-2016-109722,Samsung Galaxy S III blue T Mobile
CA-2016-109722,Fellowes Bankers Box Staxonsteel Drawer File System
CA-2015-136798,Wilson Jones Size Binders
CA-2015-136798,VTech DS6151
CA-2015-136798,Deflect EconoMat Bevel Mat Pile
CA-2017-122196,GE
CA-2017-142090,Logitech Wireless Headset G930
CA-2017-142090,Bush Advantage Collection Racetrack Conference Table
CA-2017-160934,Newell
CA-2014-124478,Sharp Digital Laser Copier
CA-2014-124478,Acco Smartsocket Table Surge Protector Color Adapter Outlets
CA-2014-124478,Globe Weis Peel Seel Class Envelopes
CA-2014-124478,Nu Dell Float Frame x
CA-2014-124478,Motorola Droid Maxx
CA-2015-145485,Folder File
CA-2017-151071,Slant D Binder Heavy Gauge Vinyl
CA-2014-134572,Bush Advantage Collection Round Conference Table
CA-2014-134572,Folder Holder Ebony
CA-2014-134572,Riverside Furniture Stanwyck Manor Table Series
CA-2017-143217,Prestige Round Binders
US-2017-133312,Sauder Hills Woodland Oak Finish
US-2017-133312,Sterilite Officeware File Box
US-2015-137533,Xerox
CA-2016-155138,Memorex Froggy Flash Drive GB
CA-2016-155138,Petty Cash Envelope
CA-2016-108350,Xerox
CA-2015-144302,GBC White Gloss Covers Plain Front
CA-2015-109001,Samsung Convoy
CA-2015-109001,Sony Class Micro SDHC R40 Memory Card
CA-2015-109001,Avery Round Poly Binders
CA-2017-132738,Hammermill CopyPlus Copy Paper Bright
CA-2017-132738,Manila Heavyweight Clasp Envelopes x
CA-2017-156720,Rubber Bands
CA-2015-119102,Advantus Storage Box
US-2014-140452,Bionaire HEPA Air Cleaner
US-2014-140452,KI Height Table
US-2014-140452,Shocksock Galaxy S4 Armband
US-2014-140452,Nu Dell Float Frame x
US-2014-140452,Ibico Covers Plastic Wire Elements
US-2014-140452,Rogers Deluxe File
CA-2015-141936,CD Pocket
CA-2014-158442,Newell
CA-2014-158442,Xerox
CA-2014-158442,Xerox
CA-2015-167374,Southworth Cotton Antique Laid Paper Envelopes
CA-2015-167374,Verbatim GB Blu ray Single Layer Disc Pack
CA-2014-116568,Iceberg Chair x x
CA-2015-147102,Kensington K72356US Mouse Box USB Desktop Mouse
CA-2017-132213,Newell
CA-2017-132213,Stanley Bostitch Electric Pencil Sharpeners
CA-2014-138450,White Business Envelopes Seam White Business Envelopes
CA-2014-138450,Eldon Base storage shelf platinum
CA-2014-138450,Adams Message Pads
CA-2015-153073,Eldon ImÃ ge Series Desk Accessories
CA-2016-147970,Xerox
CA-2016-150658,Avery Non Stick Binders
CA-2017-125640,Avery
CA-2017-154137,Belkin OmniView SE Rackmount Kit
CA-2015-127173,Vinyl Wire Paper Clips Organizer Box Box
CA-2015-127173,Ativa MDM8000 Sheet Micro Cut Shredder
CA-2015-127173,GBC Covers
CA-2014-149538,Safco
CA-2014-149538,Logitech Wireless Marathon Mouse M705
CA-2014-149538,Xerox
CA-2014-149538,Xerox
CA-2014-160766,KI Height Table
CA-2014-160766,Staple envelope
CA-2014-160766,Ativa V4110MDD Micro Cut Shredder
CA-2014-160766,Honeywell Enviracaire HEPA Air Cleaner x Room
CA-2014-160766,Spigen Samsung Galaxy S5 Case Wallet
CA-2014-160766,Vtech CS6719
CA-2014-160766,Xerox
CA-2017-146626,Nu Dell Executive Frame
CA-2015-123330,Innergie mMini Combo Duo USB Travel Kit
CA-2017-155607,Black Decker Filter Action Dustbuster Cordless Vac BLDV7210
CA-2017-155607,Machine Supplies
CA-2016-151323,Advantus SlideClip Paper Clips
CA-2015-146696,Wilson Jones Standard D Binders
CA-2016-128972,Master Giant Foot Doorstop Safety
CA-2017-128335,Staple envelope
CA-2017-128335,Speediset Carbonless Redi Letter x
CA-2015-154886,Microsoft Arc Touch Mouse
CA-2016-111213,Hon Deluxe Fabric Chairs
CA-2016-111213,Staple remover
CA-2016-111213,Avery Non Stick Binders
CA-2017-161333,Howard Miller Diameter Grantwood Wall Clock
CA-2017-161333,Multi Use File Cart Caster Set Bins
CA-2017-161333,Harmony HEPA Air Purifiers
CA-2017-128734,Self Desk Frames
CA-2017-128734,Leather Executive Chair
CA-2014-141796,Polycom SoundStation2 EX ConferenceÂ phone
CA-2017-125101,File Shuttle II Handi File Black
CA-2017-169929,Iris Project Case
US-2014-121566,Poly Pocket Divider Pockets Binders
US-2014-121566,Sanford Uni Blazer View Highlighters Chisel Tip
US-2015-124219,Wilson Jones View Binder White
US-2015-124219,Tenex V2T RE Standard Weight Series Chair Mat x Lip x
CA-2017-163006,Samsung Galaxy S4
CA-2017-163006,Enterprise Series Swivel Tilt Chairs
CA-2017-163006,Seth Thomas Wall Clock
CA-2015-156146,Panasonic KX TG6844B Digital Cordless Telephone
CA-2015-156146,Plantronics MX500i Earset
CA-2014-111192,Rush Hierlooms Collection Thick Bookcases
CA-2016-115378,Novimex Swivel Fabric Task Chair
CA-2015-161627,Novimex Turbo Task Chair
CA-2014-121006,Avery Hi Liter Comfort Grip Fluorescent Highlighter Ink
CA-2014-121006,Xerox
CA-2014-121006,Xerox Series MultiUse Premium Copy Paper Bright
CA-2014-121006,Hon Day Series Multi Task Chairs
CA-2014-121006,Acco Perma Storage Drawers
CA-2014-121006,Hot File Pocket Floor Stand
CA-2016-122903,HON Series Task Chairs Tall
CA-2016-122903,Xerox
CA-2016-122903,Xerox
CA-2015-107741,Dixon Prang Watercolor Pencils Color Set Brush
CA-2017-106432,SlimView Poly Binder
CA-2017-106432,Rush Hierlooms Collection Wood Bookcases
CA-2016-148908,GBC Twin Loop Wire Elements
CA-2016-123015,Round Binders
US-2015-120502,Face Poster Frame
US-2015-120502,Aastra VoIP phone
US-2015-120502,Replacement Filter Office Air Cleaner x Room
CA-2017-108749,Xerox
CA-2017-108749,Aluminum Screw Posts
CA-2017-163335,Fellowes Desktop File Manager
CA-2017-163335,Avery Poly Binders
CA-2015-134719,Tennsco Single Tier Lockers
US-2015-154389,LG Exalt
CA-2015-115567,Case Logic Wireless Keyboard
CA-2015-115567,Hon Multipurpose Arm Chairs
US-2017-136679,V7 USB Keypad
US-2017-136679,Boston Electric Pencil Sharpener Model Charcoal Black
US-2017-141943,Peel Seel Catalog Envelopes Brown
CA-2014-101560,Eldon Cleatmat Chair Mats Pile Carpets
CA-2014-101560,Xerox
CA-2014-101560,Crayola Pencils
CA-2014-101560,GBC Twin Loop Wire Elements Spine Black
CA-2014-159709,Strathmore Envelopes Ultimate White
CA-2014-159709,LF Elite Dazzle Designer Hard Case Cover Lf Stylus Pen Apple Iphone Mini Lite
CA-2016-103982,Speed Electric Letter Opener
CA-2016-103982,Acco Banker Clasps
CA-2016-103982,Polycom VVX VoIP phone
CA-2016-103982,Verbatim GB Blu ray Single Layer Disc Pack
CA-2015-142454,Tensor Computer Lamp
CA-2015-142454,Mobile File Cube
CA-2015-102015,Binney Smith Crayola Pencils Color Set
CA-2015-102015,Gould Plastics Pocket Panel Bin x x Black
CA-2015-102015,OIC Binder Clips Mini Capacity Black
CA-2015-102015,Avery
CA-2015-102015,HP Office Paper Bright
CA-2015-102015,Tyvek Peel Seel Envelopes Plain White
CA-2015-156755,Level Single Width Carts
CA-2015-130876,File Box
CA-2016-145898,Advantus Storage Box
CA-2016-145898,Avery
CA-2016-145898,SANFORD Accent Highlighters
CA-2016-145898,Great White Multi Use Paper Bright
US-2017-159562,x Envelopes
CA-2017-134635,Xerox
CA-2017-167080,Prang Dustless Chalk Sticks
CA-2017-145653,Harbour Creations Series Chairs
CA-2014-140487,Hon Metal Bookcases Gray
CA-2017-117401,Avanti Cu Ft Refrigerator
CA-2017-117401,Motorola HK250 Universal Headset
CA-2017-117401,Universal Pressboard Report Binders Letter Size
US-2017-109582,Eaton Premium Feed Paper Cotton Letter Size White Shts Box
CA-2016-119865,SpineVue Slant D Binders
CA-2016-119865,Premium Transparent Presentation Covers Pattern x
CA-2016-119865,O Sullivan Dimensions Shelf Bookcases
US-2014-147648,Xerox
CA-2017-124436,SpineVue Slant D Binders
CA-2017-124436,Chromcraft Round Conference Tables
CA-2017-124436,Advantus Employee Month Certificate Frame x
CA-2017-124436,Pressboard Covers Storage Hooks x Light Blue
CA-2014-115084,Office Star Flex Scooter Chair Aluminum Finish Frame
CA-2017-131037,Hon Racetrack Conference Tables
CA-2016-111143,Acco Outlet Premium Surge Suppressor
CA-2014-166744,Line Cubicle Keepers Polyproplyene Holder w Velcro Bx
CA-2014-166744,O Sullivan Dimensions Shelf Bookcases
CA-2014-166744,Logitech M325 Wireless Mouse Web
CA-2016-116561,Stur D Stor Shelf H x W x D
CA-2016-116561,GBC Standard Therm Covers
